{
    "componentChunkName": "component---node-modules-gatsby-theme-buzzing-src-gatsby-theme-blog-core-templates-post-query-js",
    "path": "/youtube/rhdRwT6Rcoo",
    "result": {"data":{"site":{"siteMetadata":{"title":"Youtube 热门","author":"Buzzing.cc","description":"用中文浏览 Youtube 上的全球热门视频","keywords":["buzzing","Youtube","视频","国外流行","热门视频"],"siteUrl":"https://youtube.buzzing.cc","telegram":"@buzzingcc","iconUrl":"https://youtube.buzzing.cc/avatar.png","defaultSocialImageUrl":null,"social":[{"name":"Youtube","url":"https://www.youtube.com/","external":true},{"name":"Buzzing","url":"https://www.buzzing.cc/","external":true}],"menuLinks":[{"name":"每周精选","url":"/issues","external":null}],"disqus":null,"utterances":null,"localize":[{"title":"Buzzing on Youtube","description":"See what's buzzing on Youtube in your native language","keywords":["buzzing","Youtube","Youtube Top","Youtube Hot"],"locale":"en","social":{"name":null,"url":null,"external":null},"menuLinks":[{"name":"Weekly Selection","url":"/en/issues","external":null}]},{"title":"Youtube 熱門","description":"用中文瀏覽 Youtube 上的全球熱門視頻","keywords":["buzzing","Youtube","視頻","國外流行","熱門視頻"],"locale":"zh-Hant","social":null,"menuLinks":[{"name":"每週精選","url":"/zh-Hant/issues","external":null}]},{"title":"Youtube 人気の動画","description":"人気のYoutube動画を日本語で閲覧","keywords":["buzzing","Youtube"],"locale":"ja","social":null,"menuLinks":[{"name":"毎週の選択","url":"/ja/issues","external":null}]}]}},"blogPost":{"id":"YoutubePost-yt:video:rhdRwT6Rcoo","excerpt":"Minecraft But, I Can’t Touch The Color White…\nyou guys are the FRICKING BEST!!!\nroad to 50,000 subs POG!!!\nalso 40,000 SUBS!!!!\n\nsub to my friend ryder here were gonna make vids like this on his channel too\nhttps://www.youtube.com/channel/UC068_0gHd570QllFJUIVzdw\n\nsub to the person that almost edited this video (i ended up doing it) still thank you so much and subscribe to them plz\nhttps://youtu.be/mr2VVtG3lQ8\n\nfor more vids sub to my 2nd channel here\nhttps://www.youtube.com/channel/UCFYOP-1Ioyji636XDVBC9-A\n\nJoin My Discord Server Here\nhttps://discord.gg/FPuxhcqAr8\nsome good stuff on the discord coming soon btw!\n\nfollow me on twitter\nhttps://twitter.com/HyperGamezYT\n\nDON'T CLICK THIS LINK➡  https://www.youtube.com/watch?v=dQw4w9WgXcQ\n\nSubscribe to my vlog channel here \nhttps://www.youtube.com/channel/UC9NpUIDHJ25ghvrSOPqRPSg\n\nSubscribe to my friend ryder he makes the same kinda content as me\nhttps://www.youtube.com/channel/UC6DEJ_ge9xpWwoLNiESh6_Q\n\nSubscribe to my gaming channel here Plz https://www.youtube.com/channel/UCiNqpLczni_L2yZFwthezSA\n \nmy main channel plz subs here\nhttps://www.youtube.com/channel/UCZ4SGgslcv5mmabF-D5Wfrg/videos\n\nmy podcast plz sub here \nhttps://www.youtube.com/channel/UCS4o9rCmgqx2XmcAeC5Y_Dg/videos\n\n\n#TrendingMilk, #bruhify,#Shorts, #ImOof, #Trending, #recommend, #BaconShadow, #ContANT, #Buddster, #MrBruhified, #Susbruh, #Voxelness, #LonleySandwich, #coolified, #bruhifytwo, #Outcast, #SamPiez, #SpaceBerries, #FattyBlox, #LastFastboy, #ImProfied, #DontClickMe, #oofify, #THEBLACKNINJA, #Crazedplayz, #FunkyThePooh, #happify, #MrBanana, #lollify, #poggers, #Bruhdity, #MrBear, #SusDaily, #Whatif, #Eggify, #ManBruh, #mrsus, #revified, #OhThatEdit, #dumbify, #CommenterBruh, #SmileyDot, #Sowball, #Isosceles, #Ace_Pop, #Cryptix, #Starex, #ParashockX, #MrEggcellent, #DONT, #MrBeast, #dream, #Minecraft, #Roblox, #amongus, #Pewdiepie, #giveaway, #uʍopǝpᴉsdnsᴉoǝpᴉʌsᴉɥʇ #Sheeprampage #animator #animatedstory #animated #theodd1sout #rickroll #rickrollwithdiffrentlink,#$100,000  #minecraft #mod #channelge #fortnite #hacker #facereaveal #gaming #100days #100daysminecraft #100dayshardcore #minecrafthardcore #vlog #irl #fun #trailer #tech #netherite #mc #led #xbox #pc #gamer #jadenanimation #100 #nintendo #retro #retrotech #mkbhd #superhero #cool #reaction #commentary #free #vr #apple #oculus #coco #24kgoldn #dababy #shorts #timetravel #theflash #startrek #iphone12 #clustertruck #pokemon #fortnite #fortnitemontage #gamingsetup #setup #pcsetup #review #movie #plant #markrober \n\n\n \ndont mind this just some keywords\nThe shortest comment,\nlongest comment,\nget pinned,\nguess my age,\nthis video has only 1 comment,\nmrbeast wont comment,\nmrbeast commented,\ndont watch this video,\ndont click this video,\ni wont breath,\nim holding breath,\nhit subscribers,\ni will be homeless,\n69 comments,\nthis video has,","body":"Minecraft But, I Can’t Touch The Color White…\nyou guys are the FRICKING BEST!!!\nroad to 50,000 subs POG!!!\nalso 40,000 SUBS!!!!\n\nsub to my friend ryder here were gonna make vids like this on his channel too\nhttps://www.youtube.com/channel/UC068_0gHd570QllFJUIVzdw\n\nsub to the person that almost edited this video (i ended up doing it) still thank you so much and subscribe to them plz\nhttps://youtu.be/mr2VVtG3lQ8\n\nfor more vids sub to my 2nd channel here\nhttps://www.youtube.com/channel/UCFYOP-1Ioyji636XDVBC9-A\n\nJoin My Discord Server Here\nhttps://discord.gg/FPuxhcqAr8\nsome good stuff on the discord coming soon btw!\n\nfollow me on twitter\nhttps://twitter.com/HyperGamezYT\n\nDON'T CLICK THIS LINK➡  https://www.youtube.com/watch?v=dQw4w9WgXcQ\n\nSubscribe to my vlog channel here \nhttps://www.youtube.com/channel/UC9NpUIDHJ25ghvrSOPqRPSg\n\nSubscribe to my friend ryder he makes the same kinda content as me\nhttps://www.youtube.com/channel/UC6DEJ_ge9xpWwoLNiESh6_Q\n\nSubscribe to my gaming channel here Plz https://www.youtube.com/channel/UCiNqpLczni_L2yZFwthezSA\n \nmy main channel plz subs here\nhttps://www.youtube.com/channel/UCZ4SGgslcv5mmabF-D5Wfrg/videos\n\nmy podcast plz sub here \nhttps://www.youtube.com/channel/UCS4o9rCmgqx2XmcAeC5Y_Dg/videos\n\n\n#TrendingMilk, #bruhify,#Shorts, #ImOof, #Trending, #recommend, #BaconShadow, #ContANT, #Buddster, #MrBruhified, #Susbruh, #Voxelness, #LonleySandwich, #coolified, #bruhifytwo, #Outcast, #SamPiez, #SpaceBerries, #FattyBlox, #LastFastboy, #ImProfied, #DontClickMe, #oofify, #THEBLACKNINJA, #Crazedplayz, #FunkyThePooh, #happify, #MrBanana, #lollify, #poggers, #Bruhdity, #MrBear, #SusDaily, #Whatif, #Eggify, #ManBruh, #mrsus, #revified, #OhThatEdit, #dumbify, #CommenterBruh, #SmileyDot, #Sowball, #Isosceles, #Ace_Pop, #Cryptix, #Starex, #ParashockX, #MrEggcellent, #DONT, #MrBeast, #dream, #Minecraft, #Roblox, #amongus, #Pewdiepie, #giveaway, #uʍopǝpᴉsdnsᴉoǝpᴉʌsᴉɥʇ #Sheeprampage #animator #animatedstory #animated #theodd1sout #rickroll #rickrollwithdiffrentlink,#$100,000  #minecraft #mod #channelge #fortnite #hacker #facereaveal #gaming #100days #100daysminecraft #100dayshardcore #minecrafthardcore #vlog #irl #fun #trailer #tech #netherite #mc #led #xbox #pc #gamer #jadenanimation #100 #nintendo #retro #retrotech #mkbhd #superhero #cool #reaction #commentary #free #vr #apple #oculus #coco #24kgoldn #dababy #shorts #timetravel #theflash #startrek #iphone12 #clustertruck #pokemon #fortnite #fortnitemontage #gamingsetup #setup #pcsetup #review #movie #plant #markrober \n\n\n \ndont mind this just some keywords\nThe shortest comment,\nlongest comment,\nget pinned,\nguess my age,\nthis video has only 1 comment,\nmrbeast wont comment,\nmrbeast commented,\ndont watch this video,\ndont click this video,\ni wont breath,\nim holding breath,\nhit subscribers,\ni will be homeless,\n69 comments,\nthis video has,","slug":"/youtube/rhdRwT6Rcoo","title":"Minecraft But, I Can’t Touch The Color White…","tags":["TrendingMilk","bruhify","Shorts","ImOof","Trending","recommend","BaconShadow","ContANT","Buddster","MrBruhified","Susbruh","Voxelness","LonleySandwich","coolified","bruhifytwo","Outcast","SamPiez","SpaceBerries","FattyBlox","LastFastboy","ImProfied","DontClickMe","oofify","THEBLACKNINJA","Crazedplayz","FunkyThePooh","happify","MrBanana","lollify","poggers","Bruhdity","MrBear","SusDaily","Whatif","Eggify","ManBruh","mrsus","revified","OhThatEdit","dumbify","CommenterBruh","SmileyDot","Sowball","Isosceles","Ace_Pop","Cryptix","Starex","ParashockX","MrEggcellent","DONT","MrBeast","dream","Minecraft","Roblox","amongus","Pewdiepie","giveaway","Sheeprampage","animator","animatedstory","animated","theodd1sout","rickroll","rickrollwithdiffrentlink","minecraft","mod","channelge","fortnite","hacker","facereaveal","gaming","100days","100daysminecraft","100dayshardcore","minecrafthardcore","vlog","irl","fun","trailer","tech","netherite","mc","led","xbox","pc","gamer","jadenanimation","100","nintendo","retro","retrotech","mkbhd","superhero","cool","reaction","commentary","free","vr","apple","oculus","coco","24kgoldn","dababy","shorts","timetravel","theflash","startrek","iphone12","clustertruck","pokemon","fortnite","fortnitemontage","gamingsetup","setup","pcsetup","review","movie","plant","markrober","Youtube"],"date":"August 29, 2021","dateISO":"2021-08-29T17:07:17.743Z","datetime":"2021-08-29 17:07","image":null,"imageAlt":null,"socialImage":null,"__typename":"SocialMediaPost","thirdPartyId":"rhdRwT6Rcoo","provider":"Youtube","url":"https://www.youtube.com/watch?v=rhdRwT6Rcoo","originalUrl":null,"imageRemote":"https://i3.ytimg.com/vi/rhdRwT6Rcoo/hqdefault.jpg","video":{"url":"https://www.youtube.com/watch?v=rhdRwT6Rcoo","embed":null,"width":null,"height":null},"channel":null,"channelUrl":"https://www.youtube.com/channel/UCjBFH3Ba20A8MTC23kmtImA","author":"HyperGamez YT","authorUrl":null,"authorImage":null,"authorImageRemote":null,"authorSlug":null,"score":29506,"views":667582,"sharedCount":null,"likeCount":null,"sharedContent":null,"parent":{"localize":[{"title":"マインクラフト でも、白という色には触れられません...。","description":null,"locale":"ja"},{"title":"Minecraft 但是，我不能触摸白色的颜色...","description":null,"locale":"zh"},{"title":"Minecraft 但是，我不能觸摸白色的顏色...","description":null,"locale":"zh-Hant"}]}},"previous":{"id":"YoutubePost-yt:video:AC__o1UxDl8","excerpt":"LIVESTREAMS: http://twitch.tv/Limmy\n=-=-=-=-\nTwitter: http://twitter.com/DaftLimmy\nDiscord: https://discord.gg/Limmy\n=-=-=-=-\nAutobiography: https://amzn.to/2Nd1IAu","slug":"/youtube/AC__o1UxDl8","title":"Some Scots can't say \"purple burglar alarm\"","date":"August 29, 2021","__typename":"SocialMediaPost","provider":"Youtube","parent":{"localize":[{"title":"スコットランド人の中には、「紫色の防犯ベル」と言えない人もいます。","description":null,"locale":"ja"},{"title":"一些苏格兰人不会说 \"紫色防盗器\"。","description":null,"locale":"zh"},{"title":"一些蘇格蘭人不會說 \"紫色防盜器\"。","description":null,"locale":"zh-Hant"}]}},"next":{"id":"YoutubePost-yt:video:GzUGdFx7YFY","excerpt":"There are a lot of similarities between the two storms. WFAA meteorologist Jessie Hawila compares them.\nMany people are drawing comparisons between Ida and Katrina. Eerily enough, they're expected to share the same date of landfall. Katrina was August 29, 2005 and Ida will make landfall August 29, 2021. While there are tons of similarities to be found, subtle differences between the two could make a big difference in what happens in New Orleans.\n\nThe storm surge with Hurricane Ida is expected to be extreme and life-threatening. Some parts of the Louisiana coast could see storms surge of 10-15 feet. \n\nMORE: https://www.wfaa.com/article/weather/severe-weather/what-is-storm-surge-how-will-hurricane-ida-compare-to-hurricane-katrina/287-8a42f82a-1919-4e6b-b2a1-7a5bdf1ec38a","slug":"/youtube/GzUGdFx7YFY","title":"Hurricane Ida vs. Hurricane Katrina: Comparing the two storms","__typename":"SocialMediaPost","date":"August 29, 2021","provider":"Youtube","parent":{"localize":[{"title":"ハリケーン・アイダ」と「ハリケーン・カトリーナ」の比較。2つの台風を比較する","description":null,"locale":"ja"},{"title":"伊达飓风与卡特里娜飓风。对比这两场风暴","description":null,"locale":"zh"},{"title":"伊達颶風與卡特里娜颶風。對比這兩場風暴","description":null,"locale":"zh-Hant"}]}}},"pageContext":{"basePath":"/","pageType":"detail","id":"YoutubePost-yt:video:rhdRwT6Rcoo","previousId":"YoutubePost-yt:video:AC__o1UxDl8","nextId":"YoutubePost-yt:video:GzUGdFx7YFY","maxWidth":1024,"siteMetadata":null,"locale":"zh","hrefLang":"zh-Hans","originalPath":"/youtube/rhdRwT6Rcoo","dateFormat":"YYYY-MM-DD"}},
    "staticQueryHashes": ["1239077767","2744905544","3280999885"]}